{
  "arn": "arn:aws:service:us-east-1:123456789012:resource/example",
  "lastUpdatedAt": "example-value",
  "name": "Example Resource",
  "status": "ACTIVE",
  "simulationApplicationNames": "Example Resource",
  "robotApplicationNames": "Example Resource",
  "dataSourceNames": "Example Resource",
  "computeType": "example-value"
}